Key,EN,Notes,JP
aya.ambition,Tengu's Ambition: Mountaintop From Where One Grasps the Sky,,天狗の野心「天を捕まえる山嶺」
aya.rule,Tengu's Rule: Long-Toothed Wings Wrapped Round the Firmament,,天狗の統治「天空を包む歯の長い翼」
,,,
kasen.platinum,Platinum Elysium: Dancing in the Shadow of the Heavens,,プラチナのエリジウム・天の影での踊り
kasen.500,Five Hundred Years under the Five-Finger Mountain,,五指山の下に埋めた五百年
kasen.cudgel,Golden Cudgel Hidden Behind the Ear,,耳に隠した如意金箍棒
kasen.flower,Flowering Seal: Rooted in the Earth and Reaching for the Skies,,華封「根は土に、手は空へ」
kasen.stonecradle,Stone Cradle: Standing Alone on the Mountaintop,,石の揺り籠「一人で山上に立つもの」
,,,
kaguyaf.sleep,Indolence: Sleeping Through Midday,,懶惰「午後までの寝坊」
kaguyaf.remote,Lunar Eyes: Television Remote,,月眼「月兎遠隔操作術（テレビリモコン）」
kaguyaf.zawarudo,Crazy Red Eyes: The World Before the Cosmos,,狂視「広がる宇宙（ザワールド）」
kaguyaf.lunarvision,Lunar Vision: Through the Dusk and Dawn,,月視「夕暮れを超すもの」
kaguyaf.expiation,Expiation: Visible Full Moon,,滅罪「不実の月（ビジブルフルムーン）」
,,,
yukari.rabenflug,Rabenflug: Flight-Path of the Crow Intoxicated on Lunar Wine,,烏飛「月の酒に酔った烏の狂い飛び」
yukari.skyburial,Hunter's Dream: Sky Burial,,狩人の夢「鳥葬」
,,,
eraa.gc,Memory Leak: Unsatiated Wrath of the Garbage Collector,,メモリリーク「ガベージコレクタの収まらない怒り」
eraa.ip,Self-Recreation: Rewriting One Step Ahead of the Instruction Pointer,,自改「命令ポインタの一歩先を上書き」
,,,
seija.onion,Irrefutable Falsehood: syn-Propanethial S-oxide,,無反駁の虚偽「催涙因子合成酵素」
seija.rice,Darker than a Moonless Night: A Grain of Rice for a Wall of Sand,,無月よりも暗い「米一粒に砂の壁」
seija.100,Memory of Pugachev: Hyaku Shou Ik-Ki,,百姓一揆「プガチョフの記憶」
seija.circular,Fallacy: Circular Reasoning,,虚偽「循環論法」
seija.pareto,Disproven Truth: A Pareto-Optimal Nonspell,,覆された真実「パレート最適のスペルカード」
seija.potato,Army Gazing Across the Channel: Feast of Undercooked Potatoes,,生芋宴会「海峡を見渡す軍隊」
seija.consequent,Fallacy: Affirming the Consequent,,虚偽「後件肯定」
,,,
mima.keine1,Imperishable Night: Event Horizon,,永夜「事象の地平線」
mima.keine2,Ancient Night: Embarking Footprints Upon an Untraversed Land,,遺夜「未知なる地に踏んだ足跡」
mima.kaguya1,Silent Night: The Comet Cursing its Own Name,,静夜「己の名を罵る彗星」
mima.kaguya2,Imperishable Night: Anticyclonic Storm Wiping Away Desire,,永夜「欲望を捨てさせる逆渦雷」
mima.kars,Tenryuu's Descent: Kars Wandering the Asteroid Belt,,天竜の降臨「小惑星帯を漂うカーズ」
mima.stars,Silent Night: Following the Stars to the End of Nowhere,,静夜「星を世の果てまで追って」
mima.constellations,Tenryuu's Ascent: All Quiet in the Constellation's Eye,,天竜の上昇「星座の中心での静寂」
mima.andromeda,Starry Night: The Andromeda Revolving,,星夜「回転するアンドロメダ」
mima.starfall,Silent Night: Where Fallen Stars Come to Rest,,静夜「流星が眠りにつく墓場」
mima.4pt,Crescent Moon: Funeral Bell for the Four-Pointed Star,,三日月「四角の星のための弔鐘」
mima.dancing,Starry Night: Dancing Where the Sun Dares Not Shine,,星夜「太陽のあたらない所での踊り」
mima.supernova,Supernova: Temporality Consumed by its Progeny,,超新星「我が子に喰らわれる光陰」
,,,
kasen2.flower,Flowering Seal: Rooted in the Earth and Reaching for the Moon,,華封「根は土に、手は月へ」
kasen2.conspiracy,Conspiracy Woven Behind the Water Curtain,,水簾の向こうで企まれた謀議
kasen2.hakkero,Fiery-Eyed Escape from Eight Trigrams,,八卦炉からの火眼の脱出
kasen2.tss,The Shattered Sky: Where Tenryuu Consumes the North Star,,空破「天帝星を食い潰す天竜」
,,,
reimu.sssc,Silent Sinner's Summoning Ceremony,,罪と罰「召喚の儀式」
reimu.apollo,Apollon Gravity Assist,,アポロのスイングバイ
reimu.centripetal,Fantasy Seal ~Centripetal Force~,,夢想封印「求心力」
reimu.breakingwheel,The Breaking-Wheel of Karma,,業の車裂き
reimu.ssss,Silent Sinner's Secret Sentry,,罪と罰「灯台下の密偵」
reimu.avaricious,Fantasy Seal ~Impure Wrath of the Avaricious~,,夢想封印「強欲なるもの不純な憤怒」
reimu.final,Lost Cry of a Forgotten God,,忘れられた神の聞こえない鳴き声
,,,
mokou.cinder,Sacred Flame: Ashen Flight of a Cindered Soul,,浄火「灰の空を飛び渡す薪の王」
mokou.serpent,Demon's Scar: Profaned Seething Chaos Serpent,,デーモンの爪痕「罪の混沌の黒蛇」
mokou.mii,Entei: Erratic Blaze Queen's Flaming Prison,,炎帝「怪焔王大車獄」
,,,
yukariex.nightmare,Hunter's Nightmare: One-Eyed Apostle Hanging from the World Tree,,狩人の悪夢「世界樹につる隻眼の使徒」
yukariex.karyuudogari,Krähenkönig: Hunter of Hunters,,烏王「狩人狩り」
yukariex.dbf,"Profound Danmaku Bounded Field: Wisdom, Justice, and Love",,深弾幕結界「知恵・正義・愛」
,,,
shinki.uc1,Unnamed Card 1,,無名のスペルカード第１
shinki.creation,"No Creation, No Destruction",,不生不滅
shinki.uc2,Unnamed Card 2,,無名のスペルカード第２
shinki.cheetos,Eight Million Writhing Souls in One Drop of Water,,水一滴に宿る八百万の魂
shinki.uc3,Unnamed Card 3,,無名のスペルカード第３
shinki.purity,"No Defilement, No Purity",,不垢不浄
shinki.uc4,Unnamed Card 4,,無名のスペルカード第４
shinki.growth,"No Growth, No Reduction",,不増不減
shinki.uc5,Unnamed Card 5,,無名のスペルカード第５
shinki.recitation,Devil's Recitation of Eight Million Wordless Sutras,,八百万の巻物の魔神復誦
shinki.gyate,"Gone, Gone, Gone to the Other Shore",,羯諦　羯諦　波羅羯諦
shinki.final,"""Now I am Become Death, Destroyer of Worlds""",,「今や我は死なり、世界を破壊する者なり」
,,,
reymoo.dice,God's Throwing Dice,,神々のサイコロ
reymoo.wind,Winds Bringing No Change,,変化齎さぬ潮風